{
	"schemaVersion": 1,
	"id": "web",
	"driverContractVersion": 1,
	"targetSchema": {
		"type": "object",
		"additionalProperties": false,
		"required": ["baseUrl"],
		"properties": {
			"baseUrl": { "type": "string", "format": "uri" }
		}
	},
	"settingsSchema": {
		"type": "object",
		"additionalProperties": false,
		"properties": {
			"headless": { "type": "boolean" }
		}
	},
	"requiredSecretSlots": [],
	"tools": [
		{ "name": "browser_navigate" },
		{ "name": "browser_observe" },
		{ "name": "browser_act" },
		{ "name": "browser_extract" },
		{ "name": "browser_diagnostics" }
	],
	"evidenceKinds": []
}
